location,placeSep,lng,lat,fixedP
Pinos,Wichita $ United States,-97.3551624,37.6837535,After the shattering experience of the storm$ Columbus$ although he did not return to San Domingo$ remained for some time on the coast of Espanola repairing his ships and resting his exhausted crews. There were threatenings of another storm which delayed them still further$ and it was not until the middle of July that the Admiral was able to depart on the real purpose of his voyage. His object was to strike the mainland far to the westward of the Gulf of Paria$ and so by following it back eastward to find the passage which he believed to exist. But the winds and currents were very baffling; he was four days out of sight of land after touching at an island north of Jamaica; and finally$ in some bewilderment$ he altered his course more and more northerly until he found his whereabouts by coming in sight of the archipelago off the south-western end of Cuba which he had called the Gardens. From here he took a departure south-west$ and on the 30th of July came in sight of a small island off the northern coast of Honduras which he called Isla de Pinos$ and from which he could see the hills of the mainland. At this island he found a canoe of immense size with a sort of house or caboose built amidships$ in which was established a cacique with his family and dependents; and the people in the canoe showed signs of more advanced civilisation than any seen by Columbus before in these waters. They wore clothing$ they had copper hatchets$ and bells$ and palm-wood swords in the edges of which were set sharp blades of flint. They had a fermented liquor$ a kind of maize beer which looked like English ale; they had some kind of money or medium of exchange also$ and they told the Admiral that there was land to the west where all these things existed and many more. It is strange and almost inexplicable that he did not follow this trail to the westward; if he had done so he would have discovered Mexico. But one thing at a time always occupied him to the exclusion of everything else; his thoughts were now turned to the eastward$ where he supposed the Straits were; and the significance of this canoe full of natives was lost upon him.
Eden,Eden$ 8$ LA 71371$ USA,-92.2151346,31.6540615,The anxiety of Columbus to communicate the names of things before he had made sure of their substance received another rude chastisement in the events that followed the receipt in Spain of his letter announcing the discovery of the Garden of Eden and the land of pearls. People in Spain were not greatly interested in his theories of the terrestrial Paradise; but more than one adventurer pricked up his ears at the name of pearls$ and among the first was our old friend Alonso de Ojeda$ who had returned some time before from Espanola and was living in Spain. His position as a member of Columbuss force on the second voyage and the distinction he had gained there gave him special opportunities of access to the letters and papers sent home by Columbus; and he found no difficulty in getting Fonseca to show him the maps and charts of the coast of Paria sent back by the Admiral$ the veritable pearls which had been gathered$ and the enthusiastic descriptions of the wealth of this new coast. Knowing something of Espanola$ and of the Admiral also$ and reading in the despatches of the turbulent condition of the colony$ he had a shrewd idea that Columbuss hands would be kept pretty full in Espanola itself$ and that he would have no opportunity for some time to make any more voyages of discovery. He therefore represented to Fonseca what a pity it would be if all this revenue should remain untapped just because one man had not time to attend to it$ and he proposed that he should take out an expedition at his own cost and share the profits with the Crown.
Riviera,Riviera $ United States,-97.8148885,27.2986493,Here$ then$ between the narrow little house by the Gate and the clamour and business of the sea-front$ our Christophers feet carried him daily during some part of his childish life. What else he did$ what he thought and felt$ what little reflections he had$ are but matters of conjecture. Genoa will tell you nothing more. You may walk over the very spot where he was born; you may unconsciously tread in the track of his vanished feet; you may wander about the wharves of the city$ and see the ships loading and unloadingdifferent ships$ but still trafficking in commodities not greatly different from those of his day; you may climb the heights behind Genoa$ and look out upon the great curving Gulf from Porto Fino to where the Cape of the western Riviera dips into the sea; you may walk along the coast to Savona$ where Domenico had one of his many habitations$ where he kept the tavern$ and whither Christophers young feet must also have walked; and you may come back and search again in the harbour$ from the old Mole and the Bank of St. George to where the port and quays stretch away to the medley of sailing-ships and steamers; but you will not find any sign or trace of Christopher. No echo of the little voice that shrilled in the narrow street sounds in the Vico Dritto; the houses stand gaunt and straight$ with a brilliant strip of blue sky between their roofs and the cool street beneath; but they give you nothing of what you seek. If you see a little figure running towards you in a blue smock$ the head fair-haired$ the face blue-eyed and a little freckled with the strong sunshine$ it is not a real figure; it is a child of your dreams and a ghost of the past. You may chase him while he runs about the wharves and stumbles over the ropes$ but you will never catch him. He runs before you$ zigzagging over the cobbles$ up the sunny street$ into the narrow house; out again$ running now towards the Duomo$ hiding in the porch of San Stefano$ where the weavers held their meetings; back again along the wharves; surely he is hiding behind that mooring-post! But you look$ and he is not therenothing but the old harbour dust that the wind stirs into a little eddy while you look. For he belongs not to you or me$ this child; he is not yet enslaved to the great purpose$ not yet caught up into the machinery of life. His eye has not yet caught the fire of the sun setting on a western sea; he is still free and happy$ and belongs only to those who love him. Father and mother$ brothers Bartolomeo and Giacomo$ sister Biancinetta$ aunts$ uncles$ and cousins possibly$ and possibly for a little while an old grandmother at Quintothese were the people to whom that child belonged. The little life of his first decade$ unviolated by documents or history$ lives happily in our dreams$ as blank as sunshine.
Tortuga,Fort Lauderdale $ United States,-80.1066025,26.1086986,The local chief came on a visit of state to the ship; and the Admiral paid him due honour$ telling him that he came as an envoy from the greatest sovereigns in the world. But this charming king$ or cacique as they called him$ would not believe this; he thought that Columbus was$ for reasons of modesty$ speaking less than the trutha new charge to bring against our Christopher! He believed that the Spaniards came from heaven$ and that the realms of the sovereigns of Castile were in the heavens and not in this world. He took some refreshment$ as his councillors did also$ little dreaming$ poor wretches$ what in after years was to come to them through all this palavering and exchanging of presents. The immediate result of the interview$ however$ was to make intercourse with the natives much freer and pleasanter even than it had been before; and some of the sailors went fishing with the natives. It was then that they were shown some cane arrows with hardened points$ which the natives said belonged to the people of Caniba$ who$ they alleged$ came to the island to capture and eat the natives. The Admiral did not believe it; his sublime habit of rejecting everything that did not fit in with his theory of the moment$ and accepting everything that did$ made him shake his head when this piece of news was brought to him. He could not get the Great Khan out of his head$ and his present theory was that this island$ being close to the mainland of Cathay$ was visited by the armies of the Great Khan$ and that it was his men who had used the arrows and made war upon the natives. It was no good for the natives to show him some of their mutilated bodies$ and to tell him that the cannibals ate them piecemeal; he had no use for such information. His mind was like a sieve of which the size of the meshes could be adjusted at will; everything that was not germane to the idea of the moment fell through it$ and only confirmative evidence remained; and at the moment he was not believing any stories which did not prove that the Great Khan was$ so to speak$ just round the corner. If they talked about gold he would listen to them; and so the cacique brought him a piece of gold the size of his hand and$ breaking it into pieces$ gave it to him a bit at a time. This the Admiral took to be sign of great intelligence. They told him there was gold at Tortuga$ but he preferred to believe that it came from Babeque$ which may have been Jamaica and may have been nothing at all.
Nina,Neenah $ United States,-88.462609,44.1858193,Columbus did not stand out to sea on his homeward course immediately$ but still coasted along the shores of the island as though he were loth to leave it$ and as though he might still at some bend of a bay or beyond some verdant headland come upon the mines and jewels that he longed for. The mountain that he passed soon after starting he called Monte Christi$ which name it bears to this day; and he saw many other mountains and capes and bays$ to all of which he gave names. And it was a fortunate chance which led him thus to stand along the coast of the island; for on January 6th the sailor who was at the masthead$ looking into the clear water for shoals and rocks$ reported that he saw the caravel Pinta right ahead. When she came up with him$ as they were in very shallow water not suitable for anchorage$ Columbus returned to the bay of Monte Christi to anchor there. Presently Martin Alonso Pinzon came on board to report himselfa somewhat crestfallen Martin$ we may be sure$ for he had failed to find the gold the hope of which had led him to break his honour as a seaman. But the Martin Alonsos of this world$ however sorry their position may be$ will always find some kind of justification for it. It must have been a trying moment for Martin Alonso as his boat from the Pinta drew near the Nina$ and he saw the stalwart commanding figure of the white-haired Admiral walking the poop. He knew very well that according to the law and custom of the sea Columbus would have been well within his right in shooting him or hanging him on the spot; but Martin puts on a bold face as$ with a cold dread at his heart and (as likely as not) an ingratiating smile upon his face he comes up over the side. Perhaps$ being in some ways a cleverer man than Christopher$ he knew the Admirals weak points; knew that he was kind-hearted$ and would remember those days of preparation at Palos when Martin Alonso had been his principal stay and help. Martins story was that he had been separated from the Admiral against his will; that the crew insisted upon it$ and that in any case they had only meant to go and find some gold and bring it back to the Admiral. Columbus did not believe him for a moment$ but either his wisdom or his weakness prevented him from saying so. He reproached Martin Alonso for acting with pride and covetousness that night when he went away and left him; and Columbus could not think from whence had come the haughty actions and dishonesty Martin had shown towards him on that voyage. Martin had done a good trade and had got a certain amount of gold; and no doubt he knew well in what direction to turn the conversation when it was becoming unpleasant to himself. He told Columbus of an island to the south of Juana[Cuba]called Yamaye$[Jamaica]where pieces of gold were taken from the mines as large as kernels of wheat$ and of another island towards the east which was inhabited only by women.
Ceuta,Ceuta $ Spain,-5.3213455,35.8893874,Before these three learned men must Columbus now appear$ a little less happy in his mind$ and wishing that he knew more Latin. Master Rodrigo$ Master Joseph the Jew$ the Right Reverend Cazadilla: three pairs of cold eyes turned rather haughtily on the Genoese adventurer; three brains much steeped in learning$ directed in judgment on the Idea of a man with no learning at all. The Right Reverend Cazadilla$ being the Kings confessor$ and a bishop into the bargain$ could speak on that matter of converting the heathen; and he was of opinion that it could not be done. Joseph the Jew$ having made voyages$ and worked with Behaim at the astrolabe$ was surely an authority on navigation; and he was of opinion that it could not be done. Rodrigo$ being also a very learned man$ had read many books which Columbus had not read; and he was of opinion that it could not be done. Three learned opinions against one Idea; the Idea is bound to go. They would no doubt question Columbus on the scientific aspect of the matter$ and would soon discover his grievous lack of academic knowledge. They would quote fluently passages from writers that he had not heard of; if he had not heard of them$ they seemed to imply$ no wonder he made such foolish proposals. Poor Columbus stands there puzzled$ dissatisfied$ tongue-tied. He cannot answer these wiseacres in their own learned lingo; what they say$ or what they quote$ may be true or it may not; but it has nothing to do with his Idea. If he opens his mouth to justify himself$ they refute him with arguments that he does not understand; there is a wall between them. More than a wall; there is a world between them! It is his credo against their ignoro; it is$ his expecto against their non video. Yet in his credo there lies a power of which they do not dream; and it rings out in a trumpet note across the centuries$ saluting the life force that opposes its irresistible I will to the feeble Thou canst not of the worldly-wise. Thus$ in about the year 1483$ did three learned men sit in judgment upon our ignorant Christopher. Three learned men: Doctors Rodrigo$ Joseph the Jew$ and the Right Reverend Cazadilla$ Bishop of Ceuta; three risen$ stuffed to the eyes and ears with learning; stuffed so full indeed that eyes and ears are closed with it. And three men$ it would appear$ wholly destitute of mother-wit.
Hispaniola,Hispaniola,-71.5723953,19.0018663,And now$ just at the moment when he needs it most$ comes an incident that$ to a man of his religious and superstitious habit$ seems like the pointing finger of Providence. The story of the shipwrecked pilot has been discredited by nearly all the modern biographers of Columbus$ chiefly because it does not fit in with their theory of his scientific studies and the alleged bearing of these on his great discovery; but it is given by Las Casas$ who says that it was commonly believed by Columbuss entourage at Hispaniola. Moreover$ amid all the tangles of theory and argument in which the achievement of Columbus has been involved$ this original story of shipwrecked mariners stands out with a strength and simplicity that cannot be entirely disregarded by the historian who permits himself some light of imagination by which to work. It is more true to life and to nature that Columbus should have received his last impulse$ the little push that was to set his accumulated energy and determination in motion$ from a thing of pure chance$ than that he should have built his achievement up in a logical superstructure resting on a basis of profound and elaborate theory.
Miguel,San Diego $ United States,-117.1610838,32.715738,It was on the 20th of August that Columbus$ having the day before seen the last of the dim blue hills of Jamaica$ sighted again the long peninsula of Hayti$ called by him Cape San Miguel$ but known to us as Cape Tiburon; although it was not until he was hailed by a cacique who called out to him Almirante$ Almirante$ that the seaworn mariners realised with joy that the island must be Espanola. But they were a long way from Isabella yet. They sailed along the south coast$ meeting contrary winds$ and at one point landing nine men who were to cross the island$ and try to reach Isabella by land. Week followed week$ and they made very poor progress. In the beginning of September they were caught in a severe tempest$ which separated the ships for a time$ and held the Admiral weather-bound for eight days. There was an eclipse of the moon during this period$ and he took advantage of it to make an observation for longitude$ by which he found himself to be 5 hrs. 23 min.$ or 80 deg. 40$ west of Cadiz. In this observation there is an error of eighteen degrees$ the true longitude of the island of Saona$ where the observation was taken$ being 62 deg. 20 west of Cadiz; and the error is accounted for partly by the inaccuracy of the tables of Regiomontanus and partly by the crudity and inexactness of the Admirals methods. On the 24th of September they at last reached the easternmost point of Espanola$ named by Columbus San Rafael. They stood to the east a little longer$ and discovered the little island of Mona$ which lies between Espanola and Puerto Rico; and from thence shaped their course west-by-north for Isabella. And no sooner had the course been set for home than the Admiral suddenly and completely collapsed; was carried unconscious to his cabin; and lay there in such extremity that his companions gave him up for lost.
RABIDA,Rabida Island$ Ecuador,-90.71052670000002,-0.4171989,CHAPTER X. OUR LADY OF LA RABIDA
Rota,Rota $ Spain,-6.3601441,36.6236874,His first care was to take little Diego to the town of Huelva$ where there lived a sister of Philippas who had married a Spaniard named Muliartes. This done$ he was able to devote himself solely to the furtherance of his Idea. For this purpose he went to Seville$ where he attached himself for a little while to a group of his countrymen who were settled there$ among them Antonio and Alessandro Geraldini$ and made such momentary living as was possible to him by his old trade. But the Idea would not sleep. He talked of nothing else; and as men do who talk of an idea that possesses them wholly$ and springs from the inner light of faith$ he interested and impressed many of his hearers. Some of them suggested one thing$ some another; but every one was agreed that it would be a good thing if he could enlist the services of the great Count (afterwards Duke) of Medini Celi$ who had a palace at Rota$ near Cadiz.
Ocean,Ocean County$ NJ$ USA,-74.3118212,39.9652553,This conception of the world excluded the Pacific Ocean and the continent of North and South America$ and made it reasonable to suppose that any one who sailed westward long enough from Spain would ultimately reach Cathay and the Indies. Behaims globe$ which was completed in the year 1492$ represented the farthest point that geographical knowledge had reached previous to the discoveries of Columbus$ and on it is shown the island of Cipango or Japan.
Aragon,Aragon$ Spain,-0.9056623,41.5976275,This Pope$ who was a native of Aragon and had been a subject of Ferdinand$ was a stolid$ perverse$ and stubborn being; so much is advertised in his low forehead$ impudent prominent nose$ thick sensual lips$ and stout bull neck. This Pope considers the matter; considers$ by such lights as he has$ to whom he shall entrust the souls of these new heathen; considers which country$ Spain or Portugal$ is most likely to hold and use the same for the increase of the Christian faith in general$ the furtherance of the Holy Catholic Church in special$ and the aggrandisement of Popes in particular; and shrewdly decides that the country in which the. Inquisition can flourish is the country to whom the heathen souls should be entrusted. He therefore issues a Bull$ dated May 3$ 1493$ granting to the Spanish the possession of all lands$ not occupied by Christian powers$ that lie west of a meridian drawn one hundred leagues to the westward of the Azores$ and to the Portuguese possession of all similar lands lying to the eastward of that line. He sleeps upon this Bull$ and has inspiration; and on the morrow$ May 4th$ issues another Bull$ drawing a line from the arctic to the antarctic pole$ and granting to Spain all heathen inheritance to the westward of the same. The Pope$ having signed this Bull$ considers it further-assisted$ no doubt$ by the Portuguese Ambassador at the Vatican$ to whom it has been shown; realises that in the wording of the Bull an injustice has been done to Portugal$ since Spain is allowed to fix very much at her own convenience the point at which the line drawn from pole to pole shall cut the equator; and also because$ although Spain is given all the lands in existence within her territory$ Portugal is only given the lands which she may actually have occupied. Even the legal mind of the Pope$ although much drowsed and blunted by brutish excesses$ discerns faultiness in this document; and consequently on the same day issues a third Bull$ in which the injustice to Portugal is redressed. Nothing so easy$ thinks the Pope$ as to issue Bulls; if you make a mistake in one Bull$ issue another; and$ having issued three Bulls in twenty-four hours$ he desists for the present$ having divided the earthly globe.
Newfoundland,Newfoundland and Labrador$ Canada,-57.6604364,53.1355091,The reasons for doubting that this voyage took place are due simply to Columbuss habit of being untruthful in regard to his own past doings$ and his propensity for drawing the long bow; and the reason that has been accepted by most of his biographers who have denied the truth of this statement is that$ in the year 1492$ when Columbus was addressing the King and Queen of Spain on his qualifications as a navigator$ and when he wished to set forth his experience in a formidable light$ he said nothing about this voyage$ but merely described his explorations as having extended from Guinea on the south to England on the north. A shrewd estimate of Columbuss character makes it indeed seem incredible that$ if he had really been in Iceland$ he should not have mentioned the fact on this occasion; and yet there is just one reason$ also quite characteristic of Columbus$ that would account for the suppression. It is just possible that when he was at Thule$ by which he meant Iceland$ he may have heard of the explorations in the direction of Greenland and Newfoundland; and that$ although by other navigators these lands were regarded as a part of the continent of Europe$ he may have had some glimmerings of an idea that they were part of land and islands in the West; and he was much too jealous of his own reputation as the great and only originator of the project for voyaging to the West$ to give away any hints that he was not the only person to whom such ideas had occurred. There is deception and untruth somewhere; and one must make ones choice between regarding the story in the first place as a lie$ or accepting it as truth$ and putting down Columbuss silence about it on a later occasion to a rare instinct of judicious suppression. There are other facts in his life$ to which$ we shall come later$ that are in accordance with this theory. There is no doubt$ moreover$ that Columbus had a very great experience of the sea$ and was one of the greatest practical seamen$ if not the greatest$ that has ever lived; and it would be foolish to deny$ except for the greatest reasons$ that he made a voyage to the far North$ which was neither unusual at the time nor a very great achievement for a seaman of his experience.
