location,placeSep,lng,lat,fixedP
Guanahani,Guanahani$ Buenos Aires$ Argentina,-58.3802182,-34.6348804,They brought some women and boys with them$ and the fleet must now have had a large number of these willing or unwilling captives. This was the first organised transaction of slavery on the part of Columbus$ whose design was to send slaves regularly back to Spain in exchange for the cattle and supplies necessary for the colonies. There was not very much said now about religious conversion$ but only about exchanging the natives for cattle. The fine point of Christophers philosophy on this subject had been rubbed off; he had taken the first step a year ago on the beach at Guanahani$ and after that the road opened out broad before him. Slaves for cattle$ and cattle for the islands; and wealth from cattle and islands for Spain$ and payment from Spain for Columbus$ and money from Columbus for the redemption of the Holy Sepulchrethese were the links in the chain of hope that bound him to his pious idea. He had seen the same thing done by the Portuguese on the Guinea coast$ and it never occurred to him that there was anything the matter with it. On the contrary$ at this time his idea was only to take slaves from among the Caribs and man-eating islanders as a punishment for their misdeeds; but this$ like his other fine ideas$ soon had to give way before the tide of greed and conquest.
Ethiopia,Ethiopia,40.489673,9.145000000000001,There was a state reception$ with Admiral Azumbaga walking in front in scarlet and brocade$ followed by his captains$ Columbus among them$ dressed in gorgeous tunics and cloaks with golden collars and$ well hidden beneath their finery$ good serviceable cuirasses. The banner of Portugal was ceremoniously unfurled and dis played from the top of a tall tree. An altar was erected and consecrated by the chaplain to the expedition$ and a mass was sung for the repose of the soul of Prince Henry. The Portugal contingent were then met by Caramansa$ the king of the country$ who came$ surrounded by a great guard of blacks armed with assegais$ their bodies scantily decorated with monkey fur and palm leaves. The black monarch must have presented a handsome appearance$ for his arms and legs were decked with gold bracelets and rings$ he had a kind of dog-collar fitted with bells round his neck$ and some pieces of gold were daintily twisted into his beard. With these aids to diplomacy$ and doubtless also with the help of a dram or two of spirits or of the wine of Oporto$ the treaty was soon concluded$ and a very shrewd stroke of business accomplished for the King of Portugal; for it gave him the sole right of exchanging gaudy rubbish from Portugal for the precious gold of Ethiopia. When the contents of the two freight-ships had been unloaded they were beached and broken up by the orders of King John$ who wished it to be thought that they had been destroyed in the whirlpools of that dangerous sea$ and that the navigation of those rough waters was only safe for the caravels of the Navy. The fort was built in twenty days$ and the expedition returned$ laden with gold and ivory; Admiral Azumbaga remained behind in command of the garrison.
Ancona,Ancona $ Italy,13.518915,43.6158299,A great quantity of birds that began to fly about the ship made him think that they were near land$ but they turned out to be the harbingers of a storm. On Tuesday$ February 12th$ the sea and wind began to rise$ and it continued to blow harder throughout that night and the next day. The wind being aft he went under bare poles most of the night$ and when day came hoisted a little sail; but the sea was terrible$ and if he had not been so sure of the staunch little Nina he would have felt himself in danger of being lost. The next day the sea$ instead of going down$ increased in roughness; there was a heavy cross sea which kept breaking right over the ship$ and it became necessary to make a little sail in order to run before the wind$ and to prevent the vessel falling back into the trough of the seas. All through Thursday he ran thus under the half hoisted staysail$ and he could see the Pinta running also before the wind$ although since she presented more surface$ and was able to carry a little more sail than the Nina$ she was soon lost to sight. The Admiral showed lights through the night$ and this time there was no lack of response from Martin Alonso; and for some part of that dark and stormy night these two humanly freighted scraps of wood and cordage staggered through the gale showing lights to each other; until at last the light from the Pinta disappeared. When morning came she was no longer to be seen; and the wind and the sea had if anything increased. The Nina was now in the greatest danger. Any one wave of the heavy cross sea$ if it had broken fairly across her$ would have sunk her; and she went swinging and staggering down into the great valleys and up into the hills$ the steersmans heart in his mouth$ and the whole crew in an extremity of fear. Columbus$ who generally relied upon his seamanship$ here invoked external aid$ and began to offer bargains to the Almighty. He ordered that lots should be cast$ and that he upon whom the lot fell should make a vow to go on pilgrimage to Santa Maria de Guadaloupe carrying a white candle of five pounds weight. Same dried peas were brought$ one for every member of the crew$ and on one of them a cross was marked with a knife; the peas were well shaken and were put into a cap. The first to draw was the Admiral; he drew the marked pea$ and he made the vow. Lots were again drawn$ this time for a greater pilgrimage to Santa Maria de Loretto in Ancona; and the lot fell on a seaman named Pedro de Villa$the expenses of whose pilgrimage Columbus promised to pay. Again lots were drawn for a pilgrimage to the shrine of Santa Clara of Moguer$ the pilgrim to watch and pray for one night there; and again the lot fell on Columbus. In addition to these$ every one$ since they took themselves for lost$ made some special and private vow or bargain with God; and finally they all made a vow together that at the first land they reached they would go in procession in their shirts to pray at an altar of Our Lady.
Republic,Oklahoma City $ United States,-97.5341023,35.5324359, By far the most important element in the navigation of Columbus$ in so far as estimating his position was concerned$ was what is known as dead-reckoning that is to say$ the computation of the distance travelled by the ship through the water. At present this distance is measured by a patent log$ which in its commonest form is a propeller-shaped instrument trailed through the water at the end of a long wire or cord the inboard end of which is attached to a registering clock. On being dragged through the water the propeller spins round and the twisting action is communicated by the cord to the clock-work machinery which counts the miles. In the case of powerful steamers and in ordinary weather dead-reckoning is very accurately calculated by the number of revolutions of the propellers recorded in the engine-room; and a device not unlike this was known to the Romans in the time of the Republic. They attached small wheels about four feet in diameter to the sides of their ships; the passage of the water turned the wheels$ and a very simple gearing was arranged which threw a pebble into a tallypot at each revolution. This device$ however$ seems to have been abandoned or forgotten in Columbuss day$ when there was no more exact method of estimating dead-reckoning than the primitive one of spitting over the side in calm weather$ or at other times throwing some object into the water and estimating the rate of progress by its speed in passing the ships side. The hour-glass$ which was used to get the multiple for long distances$ was of course the only portable time measurer available for Columbus. These$ with a rough knowledge of astronomy$ and the taking of the altitude of the polar star$ were the only known means for ascertaining the position of his ship at sea.
Hill,Hill County$ TX$ USA,-97.179026,32.0621768,There are no paths or footprints left in the sea$ and the water furrowed on that morning more than four hundred years ago by the keels of Columbuss little fleet is as smooth and trackless as it was before they clove it. Yet if you approach Guanahani from the east during the hours of darkness you also will see a light that waxes and wanes on the horizon. What the light was that Columbus saw is not certain; it was probably the light from a torch held by some native woman from the door of her hut; but the light that you will see is from the lighthouse on Dixon Hill$ where a tower of coral holds a lamp one hundred and sixty feet above the sea at the north-east point of the island. It was erected in no sentimental spirit$ but for very practical purposes$ and at a date when Watlings Island had not been identified with the Guanahani of Columbuss landfall; and yet of all the monuments that have been raised to him I can think of nothing more appropriate than this lonely tower that stands by day amid the bright sunshine in the track of the trade wind$ and by night throws its powerful double flash every half-minute across the dark lonely sea. For it was by a light$ although not of mans kindling$ that Columbus was guided upon his lonely voyage and through his many difficulties; amid all his trials and disappointments$ dimly as it must have burned sometimes$ it never quite went out. Darkness was the name of the sea across which he took his way; darkness$ from his religious point of view$ was the state of the lands to which he journeyed; and$ whatever its subsequent worth may have been$ it was a burning fragment from the living torch of the Christian religion that he carried across the world with him$ and by which he sought to kindle the fire of faith in the lands of his discovery. So that there is a profound symbolism in those raying beams that now$ night after night$ month by month$ and year after year$ shine out across the sea from Watlings Island in the direction of the Old World.
Saint,Saint Louis $ United States,-90.23382319999999,38.6354598,Once more he exhibited his easy mastery of the art of navigation and his extraordinary gift for estimating dead-reckoning. After having been out of sight of land for eight weeks$ and while some of the sailors thought they might be in the Bay of Biscay$ and others that they were in the English Channel$ the Admiral suddenly announced that they were close to Cape Saint Vincent.
Ganges,Ganges,83.0319706,27.4036401,Still Columbus went on in pursuit of his geographical chimera; even gold had no power to detain him from the earnest search for this imaginary strait. Here and there along the coast he saw increasing signs of civilisationonce a wall built of mud and stone$ which made him think of Cathay again. He now got it into his head that the region he was in was ten days journey from the Ganges$ and that it was surrounded by water; which if it means anything means that he thought he was on a large island ten days sail to the eastward of the coast of India. Altogether at sea as to the facts$ poor Admiral$ but with heart and purpose steadfast and right enough.
Gate,Mohenjo-daro $ Pakistan,68.131907,27.3294326,Owing$ no doubt$ to the difficulties that this un fortunate purchase plunged him into$ Domenico was obliged to mortgage his house at St. Andrews Gate in the year 1477; and in 1489 he finally gave it up to Jacob Baverelus$ the cheese-monger$ his son-in-law. Susanna$ who had been the witness of his melancholy transactions for so many years$ and possibly the mainstay of that declining household$ died in 1494; but not$ we may hope$ before she had heard of the fame of her son Christopher. Domenico$ in receipt of a pension from the famous Admiral of the Ocean$ and no doubt talking with a deal of pride and inaccuracy about the discovery of the New World$ lived on until 1498; when he died also$ and vanished out of this world. He had fulfilled a noble destiny in being the father of Christopher Columbus.
Anne,Spruce $ United States,-83.55847949999999,44.7563515,The low coast of Jamaica$ hazy and blue at first$ but afterwards warming into a golden belt crowned by the paler and deeper greens of the foliage$ was sighted first by Columbus on Sunday$ May 4th; and he anchored the next day in the beautiful harbour of Saint Anne$ to which he gave the name of Santa Gloria. To the island itself he gave the name of Santiago$ which however has never displaced its native name of Jamaica. The dim blue mountains and clumps of lofty trees about the bay were wonderful even to Columbus$ whose eyes must by this time have been growing accustomed to the beauty of the West Indies$ and he lost his heart to Jamaica from the first moment that his eyes rested on its green and golden shores. Perhaps he was by this time a little out of conceit with Hayti; but be that as it may he retracted all the superlatives he had ever used for the other lands of his discovery$ and bestowed them in his heart upon Jamaica.
Isle,Isle $ United States,-93.4707923,46.138011,After sailing west two thousand leagues Cabot found land in the neighbourhood of Cape Breton$ and was thus in all probability the first discoverer$ since the Icelanders$ of the mainland of the New World. He turned northward$ sailed through the strait of Belle Isle$ and came home again$ having accomplished his task in three months. Cabot$ like Columbus$ believed he had seen the territory of the Great Khan$ of whom he told the interested population of Bristol some strange things. He further told them of the probable riches of this new land if it were followed in a southerly direction; told them some lies also$ it appears$ since he said that the waters there were so dense with fish that his vessels could hardly move in them. He received a gratuity of L10 and a pension$ and made a great sensation in Bristol by walking about the city dressed in fine silk garments. He took other voyages also with his son Sebastian$ who followed with him the rapid widening stream of discovery and became Pilot Major of Spain$ and President of the Congress appointed in 1524 to settle the conflicting pretensions of various discoverers; but so far as our narrative is concerned$ having sailed across from Bristol and discovered the mainland of the New World some years before Columbus discovered it$ John Cabot sails into oblivion.
Santiago,Santiago $ Chile,-70.6692655,-33.4488897,The four ships that made up the Admirals fleet on his fourth and last voyage were all small caravels$ the largest only of seventy tons and the smallest only of fifty. Columbus chose for his flagship the Capitana$ seventy tons$ appointing Diego Tristan to be his captain. The next best ship was the Santiago de Palos under the command of Francisco Porras; Porras and his brother Diego having been more or less foisted on to Columbus by Morales$ the Royal Treasurer$ who wished to find berths for these two brothers-in-law of his. We shall hear more of the Porras brothers. The third ship was the Gallega$ sixty tons$ a very bad sailer indeed$ and on that account entrusted to Bartholomew Columbus$ whose skill in navigation$ it was hoped$ might make up for her bad sailing qualities. Bartholomew had$ to tell the truth$ had quite enough of the New World$ but he was too loyal to Christopher to let him go alone$ knowing as he did his precarious state of health and his tendency to despondency. The captain of the Gallega was Pedro de Terreros$ who had sailed with the Admiral as steward on all his other voyages and was now promoted to a command. The fourth ship was called the Vizcaina$ fifty tons$ and was commanded by Bartolome Fieschi$ a friend of Columbuss from Genoa$ and a very sound$ honourable man. There were altogether 143 souls on board the four caravels.
Genoa,Genoa $ Italy,8.946256,44.4056499,If we examine his life in detail we find this alternating principle of conduct revealed throughout it. He was by nature clever$ kind-hearted$ rather large-souled$ affectionate$ and not very honest; all the acts prompted by his nature bear the stamp of these qualities. To them his early years had probably added little except piety$ sharp practice$ and that uncomfortable sense$ often bred amid narrow and poor surroundings$ that one must keep a sharp look-out for oneself if one is to get a share of the worlds good things. Something in his blood$ moreover$ craved for dignity and the splendour of high-sounding titles; craved for power also$ and the fulfilment of an arrogant pride. All these things were in his Ligurian blood$ and he breathed them in with the very air of Genoa. His mind was of the receptive rather than of the constructive kind$ and it was probably through those long years spent between sea voyages and brief sojourns with his family in Genoa or Savona that he conceived that vague Idea which$ as I have tried to show$ formed the impulse of his life during its brief initiative period. Having once received this Idea of discovery and like all other great ideas$ it was in the air at the time and was bound to take shape in some human brainhe had all his native and personal qualities to bring to its support. The patience to await its course he had learned from his humble and subordinate life. The ambition to work for great rewards was in his blood and race; and to belief in himself$ his curious vein of mystical piety was able to add the support of a ready belief in divine selection. This very time of waiting and endurance of disappointments also helped to cultivate in his character two separate qualitiesan endurance or ability to withstand infinite hardship and disappointment; and also a greedy pride that promised itself great rewards for whatever should be endured.
Azores,Azores$ Portugal,-25.6755944,37.7412488,Thus easy it is for a Pope to draw lines from pole to pole$ and across the deep of the sea. Yet the poles sleep still in their icy virginal sanctity$ and the blue waves through which that papal line passes shift and shimmer and roll in their free salt loneliness$ unaffected by his demarcation; the heathen also$ it appears$ since that distant day$ have had something to say to their disposition. If he had slept upon it another night$ poor Pope$ it might have occurred to him that west and east might meet on a meridian situated elsewhere on the globe than one hundred miles west of the Azores; and that the Portuguese$ who for the moment had nothing heathen except Africa left to them$ might according to his demarcation strike a still richer vein of heathendom than that granted to Spain. But the holy Pontiff$ bull neck$ low forehead$ impudent prominent nose$ and sensual lips notwithstanding$ is exhausted by his cosmographical efforts$ and he lets it rest at that. Later$ when Spain discovers that her privileges have been abated$ he will have to issue another Bull; but not to-day. Sufficient unto the day are the Bulls thereof. For the moment King proposes and Pope disposes; but the matter lies ultimately in the hands of the two eternal protagonists$ man and God.
Compline,Napa $ United States,-122.2883114,38.29862780000001,There were showers of rain sometimes$ but the moisture in that baking atmosphere only added to its stifling and enervating effects. All the while$ however$ the great slow current of the Atlantic was moving westward$ and there came a day when a heavenly breeze$ stirred in the torrid air and the musical talk of ripples began to rise again from the weedy stems of the ships. They sailed due west$ always into a cooler and fresher atmosphere; but still no land was sighted$ although pelicans and smaller birds were continually seen passing from south-west to north-east. As provisions were beginning to run low$ Columbus decided on the 31st July to alter his course to north-by-east$ in the hope of reaching the island of Dominica. But at mid-day his servant Alonso Perez$ happening to go to the masthead$ cried out that there was land in sight; and sure enough to the westward there rose three peaks of land united at the base. Here was the kind of coincidence which staggers even the unbeliever. Columbus had promised to dedicate the first land he saw to the Trinity; and here was the land$ miraculously provided when he needed it most$ three peaks in one peak$ in due conformity with the requirements of the blessed Saint Athanasius. The Admiral was deeply affected; the God of his belief was indeed a good friend to him; and he wrote down his pious conviction that the event was a miracle$ and summoned all hands to sing the Salve Regina$ with other hymns in praise of God and the Virgin Mary. The island was duly christened La Trinidad. By the hour of Compline (9 oclock in the evening) they had come up with the south coast of the island$ but it was the next day before the Admiral found a harbour where he could take in water. No natives were to be seen$ although there were footprints on the shore and other signs of human habitation.
Cardinal-Arch,Irvine $ United States,-117.7219155,33.6990751,It is to this period of splendour that the story of the egg$ which is to some people the only familiar incident in Columbian biography$ is attributed. The story is that at a banquet given by the Cardinal-Arch bishop the conversation ran$ as it always did in those days when he was present$ on the subject of the Admirals discoveries; and that one of the guests remarked that it was all very well for Columbus to have done what he did$ but that in a country like Spain$ where there were so many men learned in science and cosmography$ and many able mariners besides$ some one else would certainly have been found who would have done the same thing. Whereupon Columbus$ calling for an egg$ laid a wager that none of the company but him self could make it stand on its end without support. The egg was brought and passed round$ and every one tried to make it stand on end$ but without success. When it came to Columbus he cracked the shell at one end$ making a flat surface on which the egg stood upright; thus demonstrating that a thing might be wonderful$ not because it was difficult or impossible$ but merely because no one had ever thought of doing it before. A sufficiently inane story$ and by no means certainly true; but there is enough character in this little feat$ ponderous$ deliberate$ pompous$ ostentatious$ and at bottom a trick and deceitful quibble$ to make it accord with the grandiloquent public manner of Columbus$ and to make it easily believable of one who chose to show himself in his speech and writings so much more meanly and pretentiously than he showed himself in the true acts and business of his life.
Jutland,Egtved $ Denmark,9.201050000000002,55.62954999999999,This stream of life has grown in force and volume with the passage of ages. It has always set from shore to sea in countless currents of adventure and speculation; but it has set most strongly from East to West. On its broad bosom the seeds of life and knowledge have been carried throughout the world. It brought the people of Tyre and Carthage to the coasts and oceans of distant worlds; it carried the English from Jutland across cold and stormy waters to the islands of their conquest; it carried the Romans across half the world; it bore the civilisation of the far East to new life and virgin western soils; it carried the new West to the old East$ and is in our day bringing back again the new East to the old West. Religions$ arts$ tradings$ philosophies$ vices and laws have been borne$ a strange flotsam$ upon its unchanging flood. It has had its springs and neaps$ its trembling high-water marks$ its hour of affluence$ when the world has been flooded with golden humanity; its ebb and effluence also$ when it has seemed to shrink and desert the kingdoms set upon its shores. The fifteenth century in Western Europe found it at a pause in its movements: it had brought the trade and the learning of the East to the verge of the Old World$ filling the harbours of the Mediterranean with ships and the monasteries of Italy and Spain with wisdom; and in the subsequent and punctual decadence that followed this flood$ there gathered in the returning tide a greater energy and volume which was to carry the Old World bodily across the ocean. And yet$ for all their wisdom and power$ the Spanish and Portuguese were still in the attitude of our primitive man$ standing on the sea-shore and looking out in wonder across the sea.
Flores,Flores Department$ Uruguay,-56.8984566,-33.5169429,And so he went on for several days$ with the wind veering always south and south-west$ and pointing pretty steadily to the north-east. On February 4th he changed his course$ and went as near due east as he could. They now began to find themselves in considerable doubt as to their position. The Admiral said he was seventy-five leagues to the south of Flores; Vincenti Pinzon and the pilots thought that they had passed the Azores and were in the neighbourhood of Madeira. In other words$ there was a difference of 600 miles between their estimates$ and the Admiral remarks that the grace of God permitting$ as soon as land is seen$ it will be known who has calculated the surest.
